{
  "schema_version": 1,
  "task": "object_detection",
  "prompt_mode": "fixed_classes",
  "fixed_classes": [
    "person",
    "bicycle",
    "car",
    "motorcycle",
    "airplane",
    "bus",
    "train",
    "truck",
    "boat",
    "traffic light",
    "fire hydrant",
    "stop sign",
    "parking meter",
    "bench",
    "bird",
    "cat",
    "dog",
    "horse",
    "sheep",
    "cow",
    "elephant",
    "bear",
    "zebra",
    "giraffe",
    "backpack",
    "umbrella",
    "handbag",
    "tie",
    "suitcase",
    "frisbee",
    "skis",
    "snowboard",
    "sports ball",
    "kite",
    "baseball bat",
    "baseball glove",
    "skateboard",
    "surfboard",
    "tennis racket",
    "bottle",
    "wine glass",
    "cup",
    "fork",
    "knife",
    "spoon",
    "bowl",
    "banana",
    "apple",
    "sandwich",
    "orange",
    "broccoli",
    "carrot",
    "hot dog",
    "pizza",
    "donut",
    "cake",
    "chair",
    "couch",
    "potted plant",
    "bed",
    "dining table",
    "toilet",
    "tv",
    "laptop",
    "mouse",
    "remote",
    "keyboard",
    "cell phone",
    "microwave",
    "oven",
    "toaster",
    "sink",
    "refrigerator",
    "book",
    "clock",
    "vase",
    "scissors",
    "teddy bear",
    "hair drier",
    "toothbrush"
  ],
  "input_mode": "bounded_directory",
  "execution_mode": "batch",
  "batch_size": 1,
  "concurrency": 1,
  "max_images": 16,
  "max_results_per_image": 100,
  "job_timeout_seconds": 300,
  "ranking_policy": "throughput_first",
  "allowed_maturities": [
    "Experimental"
  ],
  "network_policy": "deny",
  "compute_policy": "cpu_only",
  "provider_allowlist": [
    "cpu"
  ],
  "precision_allowlist": [
    "fp32"
  ],
  "spdx_allowlist": [
    "NOASSERTION"
  ],
  "max_cold_start_ms": "30000",
  "max_p95_latency_ms": "5000",
  "min_repeat_throughput_fps": "0.1",
  "quality_requirement": {
    "metric_id": "simple_bbox_map50_95",
    "direction": "higher_is_better",
    "threshold": "0.2",
    "evaluation_dataset_id": "local_coco_instances_v1",
    "evaluation_dataset_sha256": "e8c7f7908f1d7278341fae127d0da654f102f11bd7b21d8aeefa635b8c810b6f",
    "evaluation_protocol_sha256": "1c74e4b6b2d93414de420fbe15ea9fd17c9de31619b1856169d803627355ba97",
    "evaluation_vocabulary_id": "torchvision-coco80"
  }
}
